Link,Title,Location,Salary,Summary
https://kr.indeed.com/viewjob?jk=6825074ac2d6f4ad,[INEEJI 인공지능연구소] AI 예측 전문기업 개발팀원,성남 분당구,,INEEJI 인공지능연구소] 예측 서비스 AI엔지니어 모집(경력)- 인공지능기반 시계열 예측 서비스 개발( Python/TensorFlow등 기반)[근무부서 및 직급/직책]근무부서: 인공지능연구소직급/직책: 사원 [자격요건...
https://kr.indeed.com/viewjob?jk=872035f47cfd4850,자산운용팀 전략/리스크팀 퀀트(겨울방학 인턴),대한민국,,공자의 경우 관련 과목 12학점 이상 이수 - Microsoft 엑셀 능숙자 선택 사항 (평가 가산점) - Python 또는 VBA 등 코딩 Skill 보유 - 관련 업종에서 2개월 이상 인턴쉽 또는 근무 경력 보유 - 관련...
https://kr.indeed.com/viewjob?jk=557fe7d3af887a99,Cymer Software Engineer,대한민국,,"experience in C/C++/MFC, and C#/Java/Scripts(VB, Python, Java) programming in extra More than 1~2 years of development..."
https://kr.indeed.com/viewjob?jk=ac9068957c550cb3,데이터 전문가(모델러/분석가/엔지니어) 모집,성남 판교역,,대용량 데이터를 효율적으로 사용하기 위한 기반 데이터 가공 지원자격 데이터 사이언스를 위한 언어(R/ Python/Scala) 및 도구(scikit-learn/Spark MLlib/Tensorflow/Pytorch 등)를...
https://kr.indeed.com/viewjob?jk=112db0c64f7899b8,[한국필립모리스] 각 부문,서울 영등포구,,통신·모바일·게임>웹프로그래머> Python|인터넷·IT·통신·모바일·게임... 용프로그래머>자바스크립트|인터넷·IT·통신·모바일·게임>응용프로그래머> Python|인터넷·IT·통신·모바일·게임>시스템프로그래머>펌웨어·어셈블러|인터...
https://kr.indeed.com/viewjob?jk=112566541738ad42,Software Developer 3,대한민국,,"Experience task automation in scripting languages like shell, Python, JavaScript, TypeScript Boat load of passion & energy..."
https://kr.indeed.com/viewjob?jk=ebd9b7e972f551fc,서버 개발자 Python(Django) Developer (신입/경력),서울 마포구,,유관직무 경력자 서버 개발자 Python(Django) Developer... 있습니다.■ 자격 요건 인터넷·IT·통신·모바일·게임>웹프로그래머> Python|인터넷·IT·통신·모바일·게임>웹프로그래머>웹개발|인터넷·IT·통신...
https://kr.indeed.com/viewjob?jk=20c20d5b4ade577d,C++ Developer for High Performance Cloud Database,서울,,"C++ Experience in multi-thread programming Experience in SQL, Python, Git Experienced... development on Linux environment..."
https://kr.indeed.com/viewjob?jk=b955c9f452035bd8,[KSTEC] 통계/Analytics 신입 및 경력사원,성남 분당구,,"지능화 (의사결정 자동화) 시스템 개발 (SPSS, SAS, R, Python, Java 기반)2. 기업용 데이터과학 & 인공지능 플랫폼 솔루션3... 게임>빅데이터·AI(인공지능)> Python|인터넷·IT·통신·모바일·게임..."
https://kr.indeed.com/viewjob?jk=397a412559c606fa,"Charging Operations Specialist, APAC Charging (English Speak...",서울,,"Data science experience including coding/scripting skills ( Python/Ruby/JS/Perl... plus. Collaborative, team oriented..."
https://kr.indeed.com/viewjob?jk=22d44a65a579f52a,광학솔루션사업부 R&D 신입 석/박사,경기도 안산,,"microscopy - 프로그래밍 언어 사용 가능자 (Matlab, Python) [학력] - 석/박사 이상, 응용물리학/이공계열 전공자 [모집직무... 개발 경험자 우대(C/C++, Python, Matlab 등) - 제어..."
https://kr.indeed.com/viewjob?jk=e11919aa1a40d234,Software Intern,서울,,"good communication skills Good Programming Skills in C#, C, Python Understanding of attached peripherals (I2C, SPI) Basic..."
https://kr.indeed.com/viewjob?jk=485252a8f28fa0f8,데이터 사이언티스트 전문가,서울특별시,,"개발 경험 . 자연어처리/시계열 분석/머신러닝/데이터 마이닝 알고리즘 이론 및 실무 적용에 대한 깊은 이해 . Python Data & Analytics 라이브러리 경험 (NLTK, Spacy, Scikit-Learn..."
https://kr.indeed.com/viewjob?jk=c74de92014f38ce0,KDI 직원,세종특별자치시 세종,,"관기관 및 국제기구 포함) 우대, 영어 및 제2외국어 능통자 우대, 통계프로그램(STATA) 및 프로그래밍( Python) 활용 능력 겸비자 우대(2명 이내) * 정규직, 무기계약직의 계약은 최초 3개월 수습기간 계약 후 평가..."
https://kr.indeed.com/viewjob?jk=35f0a25dee5f3312,딥러닝 알고리즘 및 응용 Engineer,성남 분당구,"연봉 40,000,000원 - 100,000,000원",모바일·게임>빅데이터·AI(인공지능)>인공지능(AI)|인터넷·IT·통신·모바일·게임>빅데이터·AI(인공지능)> Python|인터넷·IT·통신·모바일·게임>빅데이터·AI(인공지능)>머신러닝|인터넷·IT·통신·모바일·게임>빅데이터...
https://kr.indeed.com/viewjob?jk=733b814969bff5a7,Jr. Back-end Engineer (Python),서울 강남구,,"이런 분을 찾아요 2년 이상의 Python을 활용한 백엔드 개발 업무를 수행한 경험이 있으신 분 Django, Django Rest Framework, Flask 등의 Python web framework를 사용하여..."
https://kr.indeed.com/viewjob?jk=14d562d10c215572,"PHP, Python 신입/경력 정규직",서울 금천구,,"주식회사 비즈부스터 PHP, Python 개발자 채용 모집부문 및 자격요건 담당업무 자격요건 인원 [담당업무]*당사의 서비스(비즈탑) 솔루션 및 서비... 프로그래머>PHP |인터넷·IT·통신·모바일·게임>웹프로그래머> Python"
https://kr.indeed.com/viewjob?jk=ccd4f5407a32ba6a,Data Scientist,서울,,"analysis a plus, Programming... scripting exp.: eg. Python, C#, VBA, Java, Perl, etc. Experience in applied analytics..."
https://kr.indeed.com/viewjob?jk=e7c8c2b11f24fb43,Software Engineer,서울,,"languages, including... limited to: C++, Java, C and Python. Excellent written and verbal communication skills. About..."
https://kr.indeed.com/viewjob?jk=5ea9ea023c6ccc03,"S/W 엔지니어, 데이터분석 신입/경력 정규직, 인턴",성남 분당구,,"케이션 제작 및 유지보수 업무- Python, Golang, QT 중 선택... 2. 시스템프로그래머- Python, Golang, QT 중 선택 가능3. 영상데이터 분석 및 모델링- python기반 영상데이터 분석 및 모델링..."
https://kr.indeed.com/viewjob?jk=19da3484bd7a72f1,Machine Learning R&D 연구원,서울 서초구,,"가능) ㆍ최신 딥러닝, 기계학습 이론에 대한 이해 및 구현 역량 ㆍ Python, TnsorFlow, C/C++, TensorRT 등 프로그래밍 실무... 대한 이해 및 구현 역량 ㆍ Python, TnsorFlow, C/C++..."
https://kr.indeed.com/viewjob?jk=e8004f38042e7d44,NAVER Cloud 사내 플랫폼 운영,성남 삼평동,,"Network관련 기초 지식을 보유하고 계신 분 - script ( Python, Html, javascript, Linux shell 중 1개이상... WEB/WAS, DB운영 경험 - Python, JAVA 중 하나의 프로그..."
https://kr.indeed.com/viewjob?jk=c00ed5d001e99d45,[SPMED] IT 개발자(Back-end),부산 북구,,JAVA|인터넷·IT·통신·모바일·게임>웹프로그래머>웹개발|인터넷·IT·통신·모바일·게임>웹프로그래머>백엔드|인터넷·IT·통신·모바일·게임>웹프로그래머> Python|인터넷·IT·통신·모바일·게임>데이터베이스·DBA>MySQL
https://kr.indeed.com/viewjob?jk=71c47ac87bb4087e,기술 인턴 인공지능 응용 연구/개발 인턴,서울 관악구,,"6개월) (협의) *모집 절차: 서류 à인터뷰(오프라인) *지원 자격: 프로그래밍 언어 활용 능력: Python, C, C++ 중 1가지 이상 데이터구조, 알고리즘 과목 이수 머신러닝과 딥러닝의 기본 개념 이해 머신러닝..."
https://kr.indeed.com/viewjob?jk=7f3f57623d469750,각 부문별,서울 영등포구,,바스크립트|인터넷·IT·통신·모바일·게임>응용프로그래머>클라우드|인터넷·IT·통신·모바일·게임>응용프로그래머> Python|인터넷·IT·통신·모바일·게임>응용프로그래머>SAP·ABAP|인터넷·IT·통신·모바일·게임>웹프로그래머...
https://kr.indeed.com/viewjob?jk=df86d9b3c5f1ead7,5G R&D 소프트웨어 개발자,서울,,"Erlang, Java, Python Domain experience... 프로그래밍 언어: C, C++ (필수) / Erlang, Java, Python(우대) 기술 분야: 라디오 엑세스 네트워크, 5G NR, LTE..."
https://kr.indeed.com/viewjob?jk=45b22fa764b0dae9,"빅데이터, 인공지능(AI) 외 신입 인턴",서울 종로구,"월급 2,000,000원",AI(인공지능)>인공지능(AI)|인터넷·IT·통신·모바일·게임>빅데이터·AI(인공지능)>데이터분석|인터넷·IT·통신·모바일·게임>빅데이터·AI(인공지능)> Python|인터넷·IT·통신·모바일·게임>빅데이터·AI(인공지능)>R
https://kr.indeed.com/viewjob?jk=b3a6c83c9debcb92,네이버 파이낸셜 플랫폼 운영,성남 삼평동,,"Docker(kubernetes) 및 어플리케이션 배포 전략 지식 보유 - Shell script, python 및 web framework 등 기타 프로그래밍 언어 활용 가능 - 국가보훈대상자 및 장애인은 법령에 의거..."
https://kr.indeed.com/viewjob?jk=c793a3ef3425f495,빅데이터 분석 기술인력 (정규직),서울 강남구,,"담당업무]데이터 분석 분야 ( Python, R, SAS 기반의 DATA... BIG DATA 프로젝트 경험자, PL/PM 경력자 우대, R 또는 Python 활용가능한 경력자전공계열: 전산학, 컴퓨터공학, 수학, 응용소프트웨어..."
https://kr.indeed.com/viewjob?jk=cb4eca654b2c2901,[TmaxEdu/R&D] 연구 개발자,성남 분당구,,"CSS, JavaScript, TypeScript [Server 개발(사용 언어)] - Java, Python, SQL [Framework(사용 언어)] - React.js, Spring [입사 지원 시 참고 사항..."
https://kr.indeed.com/viewjob?jk=3cede9ae131767ae,[NICE평가정보]상반기 경력직원 수시,서울 영등포구,,"4년제)ㆍ지원 부문 업무 관련 1년이상 경험자ㆍ데이터 분석 역량 보유 (데이터 분류 경험, R, SAS, Python 등 다뤄본 경험) 우대요건[개인신용평가 모형개발/데이터 분석 컨설팅/컨설팅]ㆍ석사학위 보유자 /리스크관리..."
https://kr.indeed.com/viewjob?jk=41eda88d237f0abe,Application Engineer for MCU & Touch,대한민국,,"optionally additional language skills (e.g. C#, C++, Python..) Experienced in low level components of timer, counter, PWM..."
https://kr.indeed.com/viewjob?jk=b5cb5146efe889a9,[ IT 취업 교육 ] 자바(JAVA) 스프링(SPRING) 웹 개발자 양성,부산 부산진구,,통신·모바일·게임>웹프로그래머>백엔드|인터넷·IT·통신·모바일·게임>응용프로그래머>Android|인터넷·IT·통신·모바일·게임>빅데이터·AI(인공지능)> Python|인터넷·IT·통신·모바일·게임>빅데이터·AI(인공지능)>R
https://kr.indeed.com/viewjob?jk=5fa942bd615ebd27,[TmaxAI/R&D] NLP(자연어음성)부문 서비스 프론트 & 백엔드 개발자,성남 분당구,,"개발 경험이 있으신 분 [음성, 자연어처리] - 관련 분야의 연구 경험 / 기본 지식 보유자 - 기본적인 Python 프로그래밍이 가능하신 분 우대사항 [프론트] - UX 기획 및 개발 유경험자 - react 개발 유경험자..."
https://kr.indeed.com/viewjob?jk=f317eb960a3ce005,Product Engineer - MPC/MDP/MDM,경기도 성남,,"experience... following: EDA with emphasis on semi OPC; C/C++, Python, TCL, MATLAB or any high-level programming language..."
https://kr.indeed.com/viewjob?jk=2b9e604e63e7e46d,[카카오커머스] 기술직군,성남 분당구,,"우대사항 - 전자금융 감독규정, PCIDSS에 대한 실무 경험이나 이해도가 높으신 분 - JAVA, Python, shell script 등 개발 역량을 갖추신 분 - 웹/앱 취약점 진단 및 모의해킹 역량을 갖추신..."
https://kr.indeed.com/viewjob?jk=5c9f84f18b1b4944,2022 데이터 사이언티스트 부문,서울 강남구,,인터넷·IT·통신·모바일·게임>ERP·시스템분석·설계>딥러닝|인터넷·IT·통신·모바일·게임>빅데이터·AI(인공지능)>머신러닝|인터넷·IT·통신·모바일·게임>빅데이터·AI(인공지능)> Python
https://kr.indeed.com/viewjob?jk=b6950e35673a5474,[SAPEON Korea] SDK 부문 개발자,성남 분당구,,인터넷·IT·통신·모바일·게임>웹프로그래머>ASP.NET|인터넷·IT·통신·모바일·게임>웹프로그래머> Python|인터넷·IT·통신·모바일·게임>웹프로그래머>프론트엔드|인터넷·IT·통신·모바일·게임>웹프로그래머>백엔드|인터넷...
https://kr.indeed.com/viewjob?jk=eba169ad2f8bfa95,Sr. Application Engineer - EBS,경기도 성남,,"programming language like Visual Basic, VBScript, or Python is also highly desirable Programming Skills like C language..."
https://kr.indeed.com/viewjob?jk=25d823b03a3113d5,Sr. Application Engineer - AMS,경기도 성남,,"plus Proficiency in Linux shell scripting, Tcl, and Python programming is a plus Proven ability to map simulator capabilities..."
https://kr.indeed.com/viewjob?jk=df21e3bb5d773616,Python Programmer,서울 서초구,,개발 – JAVA 프로그래밍(라이브러리 활용) – Spring 프레임 워크 개발 – Python API 프로그래밍 우대사항 – Python 개발 경험 – Open Source 라이브러리 개발경험 – Web 표준에 대한 경험...
https://kr.indeed.com/viewjob?jk=4a0a00afe9aa08f7,웹개발자 신입 피아스페이스(주),서울 서초구+1 지역,"월급 2,000,000원","츠관리 등)서비스 로직 설계, 구현, 배포데이터베이스 설계, 연동, 데이터 입출력- 필요업무역량 . Python Django . SQL 쿼리문, MySQL, [우대] 클라우드 DB . 서비스 설계, 제안, Discussion..."
https://kr.indeed.com/viewjob?jk=43835708050a81c8,[TmaxAI/R&D] AI & FinTech 부문 프론트엔드 개발자,성남 분당구,,"전산관련 전공 - 반응형 디자인, 웹 접근성, 웹 표준을 고려한 UI 개발 경험이 있는 분 - Node.js, Python, PHP와 같은 다양한 언어 및 프레임워크 경험이 있는 분 - 테스트 및 배포 자동화 경험이 있는 분..."
https://kr.indeed.com/viewjob?jk=adbd22b4349f9825,2022년도 1차 계약직,대전 유성구,,"부전공): 전자, 컴퓨터, 멀티미디어, 산업공학 등 이공계열 응용·시스템 SW 프로그래밍(C/C++/C#/ Python 등) 기술 응용·시스템 통합 개발 기술 3D 그래픽 엔진(언리얼/유니티 등) 프로그래밍 기술 석사 이상 2..."
https://kr.indeed.com/viewjob?jk=3cd339cf8959f44d,생명정보학 부문 박사졸 선임연구원 정규직 정규직,서울 서대문구,"연봉 50,000,000원 - 60,000,000원","- Python or R 활용가능 -Linux terminal 능숙 -생물학... 생명정보학, 생물정보학-외국어: 영어 회화가능,독해가능,작문가능- Python or R 활용가능- Linux terminal 능숙- 생물학 기초 수강..."
https://kr.indeed.com/viewjob?jk=be6c1f03fa566f8e,추천 시스템 연구/개발,성남 판교역,,"분야 석사 또는 박사 학위 소지자 적어도 하나 이상의 능숙한 프로그래밍 언어가 있으신 분 우대사항 Python, C++, GPU 프로그래밍 숙련자 TensorFlow, PyTorch, implicit 등 머신러닝/추천..."
https://kr.indeed.com/viewjob?jk=aac8e9355cb855ac,[인재풀] 아티스트 ART,서울,,Maya or 3D Max등의 아트웍 툴 사용 경험 Max script 또는 Mel Script의 사용 경험 C# 또는 Python 언어에 대한 이해 및 활용 능력 아트웍 관련 툴 제작 또는 플러그인 제작 경험
https://kr.indeed.com/viewjob?jk=20abdd225641e77a,"Software QA Infotainment Test Engineer, Bundang, Gyeonggi, K...",경기도 성남,,"one or more scripting languages... Perl, Ruby, Python, or Bash Passionate about troubleshooting failures to determine..."
https://kr.indeed.com/viewjob?jk=b9d4defa6e2b7739,"[TmaxMetaverse/R&D] 게임 엔진, 게임 서버, 메타버스 스튜디오 개발자",성남 분당구,,"유경험자 - 리액트 기반 개발 유경험자 [주 사용 언어] - C++, C# - Java Script - Python - Spring, React - HTML [지원 시 참고 사항] - 기술, 경험, 지식 등이 상세히 담긴..."
https://kr.indeed.com/viewjob?jk=e1f6164f1d03449a,주식회사 데이터스트림즈 기술연구소 Python/Java 개발자,성남 분당구,,데이터스트림즈 기술연구소 Python/Java 개발자 채용 모집부문 및 자격요건 담당업무 자격요건 우대사항 Python/Java 개발 직군 경력직... 통신·모바일·게임>웹프로그래머> Python|인터넷·IT·통신·모바일·게임...
https://kr.indeed.com/viewjob?jk=cd919aed133f6b4d,빅데이터분석 수시 채용,서울 을지로2가,,"대사항] - 빅데이터 분석 프로젝트 Leading 경력 - 보건의료 빅데이터 분석 경력 - SAS, R, Python 등 프로그래밍 가능자 - 머신러닝/딥러닝 활용 예측모형 개발 - 보건의료빅데이터(건강보험심사평가원, 국민..."
https://kr.indeed.com/viewjob?jk=045c3f7ac2bf61ab,"Lead Software Engineer, Machine Learning (English)",서울,,"machine learning. Experience coding in C++, C, or Python. Ability to speak and write in English fluently. Preferred..."
https://kr.indeed.com/viewjob?jk=19da3484bd7a72f1,Machine Learning R&D 연구원,서울 서초구,,"가능) ㆍ최신 딥러닝, 기계학습 이론에 대한 이해 및 구현 역량 ㆍ Python, TnsorFlow, C/C++, TensorRT 등 프로그래밍 실무... 대한 이해 및 구현 역량 ㆍ Python, TnsorFlow, C/C++..."
https://kr.indeed.com/viewjob?jk=53fbfe54f327d9dc,AI Software Engineer,경기도 성남,,"TensorFlow 5+ years of programming experience in Python, C/C++ and MATLAB Experience working with other developers using Git..."
https://kr.indeed.com/viewjob?jk=65e372cb5a6e5e1f,Software Architect,경기도,,"10 plus years experience with EDA software RD Strong TCL, Python and C++ programming skills We’re doing work that matters..."
https://kr.indeed.com/viewjob?jk=c1eb32d533bd1cef,고객 서비스 엔지니어,대구 달성군,"연봉 50,000,000원 - 75,000,000원",경험 ㆍHW 트러블슈팅 스킬 ㆍ리눅스에 대한 기본적인 이해 ㆍ영어 (중급 또는 그 이상) 우대사항 ㆍ Python / Shell 스크립트 경험 ㆍ일본어 가능자 Job Type: Full-time Salary: 50...
https://kr.indeed.com/viewjob?jk=4d08d3e1f1815e21,현대백화점 H.Point팀 데이터 분석/기획 경력,서울 삼성역,,"적용 모델링 - OLAP툴, R, Python, SQL 등 활용 분석 수행 및 리포팅 - 학사 이상 학위 취득자 - OLAP툴 사용 경험(3년 이상) - R, Python, SQL 등 심화 분석툴 경험(2년..."
https://kr.indeed.com/viewjob?jk=c793a3ef3425f495,빅데이터 분석 기술인력 (정규직),서울 강남구,,"담당업무]데이터 분석 분야 ( Python, R, SAS 기반의 DATA... BIG DATA 프로젝트 경험자, PL/PM 경력자 우대, R 또는 Python 활용가능한 경력자전공계열: 전산학, 컴퓨터공학, 수학, 응용소프트웨어..."
https://kr.indeed.com/viewjob?jk=447e5726f229a2b7,"Cloud Technical Solutions Engineer, Networking, Google Cloud",서울,,"reading or debugging code (e.g., Java, C, C++, .NET, Python, Shell, Perl, JavaScript). Experience advocating for customer..."
https://kr.indeed.com/viewjob?jk=b574f1454ae36aab,Cross Border Ecommerce - Business Intelligence (Based in Seo...,서울,,business analyst related roles Proficient in SQL and Python Strong analytical skill and sensitivity to data Strong oral...
https://kr.indeed.com/viewjob?jk=ac9068957c550cb3,데이터 전문가(모델러/분석가/엔지니어) 모집,성남 판교역,,대용량 데이터를 효율적으로 사용하기 위한 기반 데이터 가공 지원자격 데이터 사이언스를 위한 언어(R/ Python/Scala) 및 도구(scikit-learn/Spark MLlib/Tensorflow/Pytorch 등)를...
https://kr.indeed.com/viewjob?jk=733b814969bff5a7,Jr. Back-end Engineer (Python),서울 강남구,,"이런 분을 찾아요 2년 이상의 Python을 활용한 백엔드 개발 업무를 수행한 경험이 있으신 분 Django, Django Rest Framework, Flask 등의 Python web framework를 사용하여..."
https://kr.indeed.com/viewjob?jk=b955c9f452035bd8,[KSTEC] 통계/Analytics 신입 및 경력사원,성남 분당구,,"지능화 (의사결정 자동화) 시스템 개발 (SPSS, SAS, R, Python, Java 기반)2. 기업용 데이터과학 & 인공지능 플랫폼 솔루션3... 게임>빅데이터·AI(인공지능)> Python|인터넷·IT·통신·모바일·게임..."
https://kr.indeed.com/viewjob?jk=5ea9ea023c6ccc03,"S/W 엔지니어, 데이터분석 신입/경력 정규직, 인턴",성남 분당구,,"케이션 제작 및 유지보수 업무- Python, Golang, QT 중 선택... 2. 시스템프로그래머- Python, Golang, QT 중 선택 가능3. 영상데이터 분석 및 모델링- python기반 영상데이터 분석 및 모델링..."
https://kr.indeed.com/viewjob?jk=30e17a7d8ce9d4d4,Software Engineer,서울,,"writing optimal code... least one stack (Java, Go, Ruby, Python) Ability to work collaboratively and cross-functionally..."
https://kr.indeed.com/viewjob?jk=f647fa002f65828e,PI(Process Innovation) 분야별 경력사원,경기도 파주,,"Data 조회 Tool 활용 능력(Spotfire, EXL, SQL 등) - 분석 Tool 활용 능력(R, Python 등) 담당업무 : 제품/기술 프로세스 분석 및 프로젝트/Resource 효율화 과제 추진, PLM 시스..."
https://kr.indeed.com/viewjob?jk=bdf0194f9b034b14,[리니지2] MMORPG 서버 프로그래머 모집,성남 판교역,,Windows Programming - Web Programming - Script languages ( Python 등) 제출서류 포트폴리오(필수) 전형단계 서류전형 1차 면접 NC TEST 2차 면접 처우협의 입사 도움말...
https://kr.indeed.com/viewjob?jk=c74de92014f38ce0,KDI 직원,세종특별자치시 세종,,"관기관 및 국제기구 포함) 우대, 영어 및 제2외국어 능통자 우대, 통계프로그램(STATA) 및 프로그래밍( Python) 활용 능력 겸비자 우대(2명 이내) * 정규직, 무기계약직의 계약은 최초 3개월 수습기간 계약 후 평가..."
https://kr.indeed.com/viewjob?jk=248dc0eec10bde0c,인공지능 개발자 신입 피아스페이스(주),서울 서초구+1 지역,"월급 3,000,000원","인공지능 모델의 배포, 모니터링, 유지보수필요역량 - 인공지능(머신러닝, 딥러닝)에 대한 기본적인 이해 - Python 및 numpy, openCV 활용 능력 - 딥러닝 프레임워크 (TensorFlow 또는 PyTorch..."
https://kr.indeed.com/viewjob?jk=3fbf16cd38fd66c8,Software Developer & Verification,서울,,"Programming Language and skillset: Java(preferred), C++, Python, CI Environment, Shell Script Native Korean and business..."
https://kr.indeed.com/viewjob?jk=4cd34228af5013fd,DGIST 2019년 제1차 계약직원 공개채용 공고,대구 현풍면,,"우수자(SPSS, R 등 통계패키지) 외국어(영어) 구사 능력 우수자 Programming(MATLAB, Python, C/C++ 등) 가능자 · 근무기간 : 2019.3.11.~2020.3.10. ※ 단, 재계약 평가에..."
https://kr.indeed.com/viewjob?jk=cd829f275871114e,[SNOW] 렌더링 엔진 개발자,서울,,"팩토링, 디자인 패턴, ReactiveX 활용 경험 - Java, Swift(Objective C), Lua, Python 등 다양한 언어 경험 - Computer Graphics 이해 - Image Processing 이해..."
https://kr.indeed.com/viewjob?jk=9d966c68f91065ee,KAIST 휴머노이드로봇연구센터 위촉연구원 모집 공고,대전 유성구,,"개발자 (Robot Software Engineer) 1. 로봇 경로 계획 알고리즘 개발 2. Linux, Python/C++ 프로그래밍 개발 3. 로봇 학습 기반 제어 알고리즘 개발 ※ 자세한 직무수행 내용은 직무기술서..."
https://kr.indeed.com/viewjob?jk=7b091681f7106dcd,Head of Technical Writing,서울,,"following languages; Objective-C, Java, Swift, JavaScript, and Python ABOUT SENDBIRD Sendbird... world's leading chat..."
https://kr.indeed.com/viewjob?jk=3cd339cf8959f44d,생명정보학 부문 박사졸 선임연구원 정규직 정규직,서울 서대문구,"연봉 50,000,000원 - 60,000,000원","- Python or R 활용가능 -Linux terminal 능숙 -생물학... 생명정보학, 생물정보학-외국어: 영어 회화가능,독해가능,작문가능- Python or R 활용가능- Linux terminal 능숙- 생물학 기초 수강..."
https://kr.indeed.com/viewjob?jk=55e2f1523d6bd078,TOAST CAM AI 개발 담당자,성남 판교역,,"학사 또는 석사 학위 또는 그에 준하는 실무 경험자 (신입 지원 가능) - 임베디드 환경 개발 경험자 - Python, C++ 개발 경험자 - 임베디드 환경 개발 경험자 - Deep Learning, Computer..."
https://kr.indeed.com/viewjob?jk=eebb55f7bba4110d,"응용소프트웨어 개발자 (BIM, C#, C++, Python, api)",서울 마포구,"연봉 45,000,000원 - 70,000,000원","직무내용] - C#, C++ , Python 활용 자동화 프로그램 개발- 디지털트윈 응용 프로그램 개발 - BIM, REVIT 관련 응용 프로그램 개발- API [근무시간 및 형태] 주 5일 근무 (오전) 9시 00분~(오후..."
https://kr.indeed.com/viewjob?jk=6cfffc13b8a012c3,Product Test Engineer,서울,,"Knowledge of Compute Language in either C++/C or VB, Python is preferred.. Good command of oral and written English. Good..."
https://kr.indeed.com/viewjob?jk=5842bf7f00547688,S/W개발 신입/경력 정규직,서울 성동구,,인터넷·IT·통신·모바일·게임>응용프로그래머>자바스크립트|인터넷·IT·통신·모바일·게임>응용프로그래머> Python|인터넷·IT·통신·모바일·게임>응용프로그래머>Linux|인터넷·IT·통신·모바일·게임>빅데이터·AI(인공지능...
https://kr.indeed.com/viewjob?jk=0699e6dbb5a0ec38,Software Engineer,서울,,"skills with co-worker Good Programming Skills in C#, C, Python Embedded FW development Generate GUI (Graphic User..."
