Link,Title,Location,Salary,Summary
https://kr.indeed.com/viewjob?jk=47967030d546a166,사내 업무 프로그램 개발 정규직(신입/경력),대전 전민동,,모집부문 - 모집 부서 : 기반기술개발팀 - 해당 직군 : 프로그램 개발 - 모집 인원 : 0명 - 담당 업무 : 사내업무 기반 시스템 개발 웹 서비스 개발 자격요건 - 전공: 무관 - 학력: 무관 - 경력:…
https://kr.indeed.com/viewjob?jk=00ae478aa7aad900,[AI R&D] Language AI(NLP) Research 분야 수시 (21년4차) 모집,성남 판교역,,"모집분야 Development > AI R&D > Language AI Research 업무내용 1. 업무내용 자연어 이해 및 생성을 위한 NLP 기반 기술을 연구/개발하고, 이를 바탕으로 사람과 Machine 간…"
https://kr.indeed.com/viewjob?jk=8c125d2ddacbec6e,[SNOW] 렌더링 엔진 개발자,성남 분당구,,"SNOW Graphics에서 렌더링 엔진 개발자를 모집합니다.부서소개Graphics 부서에서는 글로벌 카메라, 비디오/이미지 편집 서비스를 위한 렌더링 엔진 개발을 하고 있습니다.채용조건- 정규직 담당업무- 3D/2D…"
https://kr.indeed.com/viewjob?jk=38a26ad31307be21,[위메프] 신규서비스 ML엔지니어,대한민국,,[반값습니다] 요즘처럼 방대한 정보 속에서 선택을 하기란 매우 쉽지 않은 일입니다. 쇼핑 할 때도 마찬가지죠. 다양한 브랜드에 가격대도 각각이라 어떤 상품을 구매해야 하는 지 고민해 본 경험은 누구라도 있을텐데요.…
https://kr.indeed.com/viewjob?jk=4d08d3e1f1815e21,현대백화점 H.Point팀 데이터 분석/기획 경력,서울 삼성역,,1. 채용 분야 모집 분야 직무 세부 지원 자격 근무지 데이터 분석 /기획 (선임급) 데이터 활용 기획 및 전략 수립 - 그룹 내/외부 데이터 통합 방안 및 플랫폼 구성 설계 - 데이터 마케팅…
https://kr.indeed.com/viewjob?jk=20b5a95b14ab7935,Application Developer,서울,,· Experience with application development and design experience on Linux and Windows based systems. · Experience…
https://kr.indeed.com/viewjob?jk=0cfec85fdee88288,ML/데이터 기반 운영 서비스 개발을 위한 백엔드 엔지니어 모집,성남 판교역,,모집분야 Development > Data Science > Data Service Development 업무내용 사내 데이터/ML 플랫폼을 기반으로 전사 업무에 필요한 인사이트 확보 및 정보 제공을 위한 웹…
https://kr.indeed.com/viewjob?jk=07375dc4e800dfa9,추천 시스템 소프트웨어 엔지니어,성남 판교역,,직원 유형 정규직 영입인원 0 명 조직소개 추천팀은 세상 모든 정보와 사용자에 대한 이해를 바탕으로 정보를 소비하고 발견하는 새로운 경험의 길을 찾고 있습니다. 추천팀에 합류하면 데이터 파이프라인 구성부터…
https://kr.indeed.com/viewjob?jk=5d5e2aa027f6e9e3,Software Engineer I,경기도 화성,,Software Engineer I and/or Software Engineer II Responsibilities Design & code a variety of complex software features…
https://kr.indeed.com/viewjob?jk=60d2552a901c0851,"Security Consultant, Professional Services",서울,,-BA/BS degree or equivalent experience -10+ years of extensive experience in IT security -Strong hands-on technical…
https://kr.indeed.com/viewjob?jk=55a19c92c845685e,Developer / Designer recruit,서울 논현동,,"MyMusicTaste puts the power in the fans' hands, allowing fans to request their favorite artist's concert in their city and…"
https://kr.indeed.com/viewjob?jk=ab58a5f77dd9c9c8,[NAVER Cloud] 빅데이터 분석 플랫폼 개발,성남 분당구,,[역할]하둡 표준 배포판 제작 업무- 하둡 에코시스템 관련 소스 분석- Apache Bigtop 을 이용한 패키지 제작 - Apache Ambari 소스 분석 - 빌드 시스템 개발- 소스 관리- 하둡 배포판 관련…
https://kr.indeed.com/viewjob?jk=692f118ecbdf4a69,Staff Data Scientist (Eats),서울,,"쿠팡은 고객이 쿠팡앱을 열어보는 순간부터 상품을 문 앞으로 배송받는 순간까지, 고객 한 분 한 분에게 감동을 줄 수 있도록 쇼핑의 경험을 새롭게 창조하고 있습니다. 뛰어난 엔드투엔드(end-to-end) 이커머스와 물류…"
https://kr.indeed.com/viewjob?jk=05a8e481d9859e2c,"고등광기술연구소 레이저응용시스템연구실 박사후연구원, 위촉연구원",광주 북구,,"박사후연구원, 위촉연구원 채용 공고 광주과학기술원 고등광기술연구소는 위촉연구원을 아래와 같이 모집공고하오니 관심 있는 분들의 지원 바랍니다. 모집구분 및 지원자격 모집구분 인원 모집분야(담당업무) 지원자격…"
https://kr.indeed.com/viewjob?jk=e48264065743d763,[(주)포이] app/web 개발자,대전 유성구,"월급 1,960,000원","[직무내용] 모집분야 및 자격요건ㆍapp/web 개발자 ( 2명 )담당업무ㆍ웹/앱 서비스 개발ㆍ반응형, 웹 표준을 고려한 웹 퍼블리싱자격요건ㆍHTML5, CSS, JavaScriptㆍiOS( Swift ) /…"
